{
  "envelope_id": "env.instruction_profile_publish_v1",
  "verb": "publish",
  "roles": {
    "publisher": "mova-core-spec-author",
    "executor": "mova-sandbox-llm-guard"
  },
  "profile": {
    "schema_id": "ds.instruction_profile_core_v1",
    "profile_id": "mova_security_default_v1",
    "profile_version": "1.0.0",
    "label": "Default MOVA security profile",
    "security_model_version": "1.0.0",
    "status": "active",
    "applies_to": {
      "executor_kinds": [
        "ai_model",
        "hybrid"
      ],
      "roles": [
        "agent",
        "assistant"
      ],
      "envelope_ids": [
        "env.mova4_core_catalog_publish_v1",
        "env.smartlink_route_decision_v1"
      ],
      "data_types": [],
      "tags": [
        "default",
        "core"
      ]
    },
    "rules": [
      {
        "rule_id": "no_direct_code_execution_without_explicit_approval",
        "description": "The executor must not run external code or shell commands unless explicitly approved by a designated human or policy.",
        "effect": "deny",
        "target": {
          "kind": "code_exec",
          "selector": "any"
        },
        "severity": "high",
        "on_violation": [
          "require_human_review",
          "alert_owner"
        ]
      }
    ],
    "meta": {
      "title": "Default MOVA security instruction profile",
      "lang": "en"
    }
  },
  "meta": {
    "created_at": "2025-12-07T00:00:00Z",
    "note": "Example of publishing a core instruction profile."
  }
}
